{
  "patient_code": "PT-5A1F0C",
  "schema_version": "2.1",
  "generated_at": "2030-01-20T09:00:00Z",
  "panels": [
    {
      "analyte": "甲胎蛋白（AFP）",
      "normalized_analyte": null,
      "values": [
        {
          "date": "2030-01-15",
          "date_kind": "reported",
          "value": null,
          "raw_value": "3.46",
          "unit": null,
          "reference_range": null,
          "report_flag": null,
          "critical_flag": null,
          "provenance_layer": "source_reported",
          "verification_status": "unverified",
          "source_refs": [
            "07_检验/肿瘤标志物/2030-01-15_肿瘤标志物_示例医院.md#L18-L55"
          ],
          "candidate_value": "3.46",
          "pairing_method": "linear_position",
          "pairing_confidence": "low",
          "pairing_note": "线性文本按位置配对的候选值（项目 8 / 数值 8 / 单位 7 / 参考范围 7），需对照原件核实。未配对列：单位列 7 个、参考范围列 7 个。"
        }
      ]
    },
    {
      "analyte": "胃泌素释放肽前体（ProGRP）",
      "normalized_analyte": null,
      "values": [
        {
          "date": "2030-01-15",
          "date_kind": "reported",
          "value": null,
          "raw_value": "118.2个",
          "unit": null,
          "reference_range": null,
          "report_flag": null,
          "critical_flag": null,
          "provenance_layer": "source_reported",
          "verification_status": "unverified",
          "source_refs": [
            "07_检验/肿瘤标志物/2030-01-15_肿瘤标志物_示例医院.md#L18-L55"
          ],
          "candidate_value": "118.2",
          "pairing_method": "linear_position",
          "pairing_confidence": "low",
          "pairing_note": "线性文本按位置配对的候选值（项目 8 / 数值 8 / 单位 7 / 参考范围 7），需对照原件核实。未配对列：单位列 7 个、参考范围列 7 个。结果串含疑似箭头识别伪影「个」，未作为报告旗标写入。"
        }
      ]
    },
    {
      "analyte": "神经元特异性烯醇化酶（NSE）",
      "normalized_analyte": null,
      "values": [
        {
          "date": "2030-01-15",
          "date_kind": "reported",
          "value": null,
          "raw_value": "21.73",
          "unit": null,
          "reference_range": null,
          "report_flag": null,
          "critical_flag": null,
          "provenance_layer": "source_reported",
          "verification_status": "unverified",
          "source_refs": [
            "07_检验/肿瘤标志物/2030-01-15_肿瘤标志物_示例医院.md#L18-L55"
          ],
          "candidate_value": "21.73",
          "pairing_method": "linear_position",
          "pairing_confidence": "low",
          "pairing_note": "线性文本按位置配对的候选值（项目 8 / 数值 8 / 单位 7 / 参考范围 7），需对照原件核实。未配对列：单位列 7 个、参考范围列 7 个。结果串含疑似箭头识别伪影「个」，未作为报告旗标写入。"
        }
      ]
    },
    {
      "analyte": "人附睾蛋白4（HE4）",
      "normalized_analyte": null,
      "values": [
        {
          "date": "2030-01-15",
          "date_kind": "reported",
          "value": null,
          "raw_value": "96.5",
          "unit": null,
          "reference_range": null,
          "report_flag": null,
          "critical_flag": null,
          "provenance_layer": "source_reported",
          "verification_status": "unverified",
          "source_refs": [
            "07_检验/肿瘤标志物/2030-01-15_肿瘤标志物_示例医院.md#L18-L55"
          ],
          "candidate_value": "96.5",
          "pairing_method": "linear_position",
          "pairing_confidence": "low",
          "pairing_note": "线性文本按位置配对的候选值（项目 8 / 数值 8 / 单位 7 / 参考范围 7），需对照原件核实。未配对列：单位列 7 个、参考范围列 7 个。"
        }
      ]
    },
    {
      "analyte": "鳞状上皮细胞癌抗原（SCC）",
      "normalized_analyte": null,
      "values": [
        {
          "date": "2030-01-15",
          "date_kind": "reported",
          "value": null,
          "raw_value": "0.8",
          "unit": null,
          "reference_range": null,
          "report_flag": null,
          "critical_flag": null,
          "provenance_layer": "source_reported",
          "verification_status": "unverified",
          "source_refs": [
            "07_检验/肿瘤标志物/2030-01-15_肿瘤标志物_示例医院.md#L18-L55"
          ],
          "candidate_value": "0.8",
          "pairing_method": "linear_position",
          "pairing_confidence": "low",
          "pairing_note": "线性文本按位置配对的候选值（项目 8 / 数值 8 / 单位 7 / 参考范围 7），需对照原件核实。未配对列：单位列 7 个、参考范围列 7 个。"
        }
      ]
    },
    {
      "analyte": "糖类抗原15-3（CA15-3）",
      "normalized_analyte": null,
      "values": [
        {
          "date": "2030-01-15",
          "date_kind": "reported",
          "value": null,
          "raw_value": "12.40",
          "unit": null,
          "reference_range": null,
          "report_flag": null,
          "critical_flag": null,
          "provenance_layer": "source_reported",
          "verification_status": "unverified",
          "source_refs": [
            "07_检验/肿瘤标志物/2030-01-15_肿瘤标志物_示例医院.md#L18-L55"
          ],
          "candidate_value": "12.40",
          "pairing_method": "linear_position",
          "pairing_confidence": "low",
          "pairing_note": "线性文本按位置配对的候选值（项目 8 / 数值 8 / 单位 7 / 参考范围 7），需对照原件核实。未配对列：单位列 7 个、参考范围列 7 个。"
        }
      ]
    },
    {
      "analyte": "铁蛋白（FER）",
      "normalized_analyte": null,
      "values": [
        {
          "date": "2030-01-15",
          "date_kind": "reported",
          "value": null,
          "raw_value": "402.6小",
          "unit": null,
          "reference_range": null,
          "report_flag": null,
          "critical_flag": null,
          "provenance_layer": "source_reported",
          "verification_status": "unverified",
          "source_refs": [
            "07_检验/肿瘤标志物/2030-01-15_肿瘤标志物_示例医院.md#L18-L55"
          ],
          "candidate_value": "402.6",
          "pairing_method": "linear_position",
          "pairing_confidence": "low",
          "pairing_note": "线性文本按位置配对的候选值（项目 8 / 数值 8 / 单位 7 / 参考范围 7），需对照原件核实。未配对列：单位列 7 个、参考范围列 7 个。结果串含疑似箭头识别伪影「小」，未作为报告旗标写入。"
        }
      ]
    },
    {
      "analyte": "糖类抗原50（CA50）",
      "normalized_analyte": null,
      "values": [
        {
          "date": "2030-01-15",
          "date_kind": "reported",
          "value": null,
          "raw_value": "7.9",
          "unit": null,
          "reference_range": null,
          "report_flag": null,
          "critical_flag": null,
          "provenance_layer": "source_reported",
          "verification_status": "unverified",
          "source_refs": [
            "07_检验/肿瘤标志物/2030-01-15_肿瘤标志物_示例医院.md#L18-L55"
          ],
          "candidate_value": "7.9",
          "pairing_method": "linear_position",
          "pairing_confidence": "low",
          "pairing_note": "线性文本按位置配对的候选值（项目 8 / 数值 8 / 单位 7 / 参考范围 7），需对照原件核实。未配对列：单位列 7 个、参考范围列 7 个。"
        }
      ]
    }
  ]
}
